[
  {
    "schema_version": "1.0",
    "source_ref": "amazon_primary",
    "marketplace": "US",
    "category_ref": "US_beauty",
    "observation_date": "2026-09-01",
    "observed_at": null,
    "time_precision": "date",
    "snapshot_ref": "synthetic-day-1",
    "rank": 1,
    "asin": "TEST000001",
    "title": "SYNTHETIC TEST PRODUCT 1",
    "brand": "SYNTHETIC",
    "source_url": "https://data.example.invalid/test"
  },
  {
    "schema_version": "1.0",
    "source_ref": "amazon_primary",
    "marketplace": "US",
    "category_ref": "US_beauty",
    "observation_date": "2026-09-01",
    "observed_at": null,
    "time_precision": "date",
    "snapshot_ref": "synthetic-day-1",
    "rank": 2,
    "asin": "TEST000002",
    "title": "SYNTHETIC TEST PRODUCT 2",
    "brand": "SYNTHETIC",
    "source_url": "https://data.example.invalid/test"
  },
  {
    "schema_version": "1.0",
    "source_ref": "amazon_primary",
    "marketplace": "US",
    "category_ref": "US_beauty",
    "observation_date": "2026-09-01",
    "observed_at": null,
    "time_precision": "date",
    "snapshot_ref": "synthetic-day-1",
    "rank": 3,
    "asin": "TEST000003",
    "title": "SYNTHETIC TEST PRODUCT 3",
    "brand": "SYNTHETIC",
    "source_url": "https://data.example.invalid/test"
  },
  {
    "schema_version": "1.0",
    "source_ref": "amazon_primary",
    "marketplace": "US",
    "category_ref": "US_beauty",
    "observation_date": "2026-09-01",
    "observed_at": null,
    "time_precision": "date",
    "snapshot_ref": "synthetic-day-1",
    "rank": 4,
    "asin": "TEST000004",
    "title": "SYNTHETIC TEST PRODUCT 4",
    "brand": "SYNTHETIC",
    "source_url": "https://data.example.invalid/test"
  },
  {
    "schema_version": "1.0",
    "source_ref": "amazon_primary",
    "marketplace": "US",
    "category_ref": "US_beauty",
    "observation_date": "2026-09-01",
    "observed_at": null,
    "time_precision": "date",
    "snapshot_ref": "synthetic-day-1",
    "rank": 5,
    "asin": "TEST000005",
    "title": "SYNTHETIC TEST PRODUCT 5",
    "brand": "SYNTHETIC",
    "source_url": "https://data.example.invalid/test"
  },
  {
    "schema_version": "1.0",
    "source_ref": "amazon_primary",
    "marketplace": "US",
    "category_ref": "US_beauty",
    "observation_date": "2026-09-01",
    "observed_at": null,
    "time_precision": "date",
    "snapshot_ref": "synthetic-day-1",
    "rank": 6,
    "asin": "TEST000006",
    "title": "SYNTHETIC TEST PRODUCT 6",
    "brand": "SYNTHETIC",
    "source_url": "https://data.example.invalid/test"
  },
  {
    "schema_version": "1.0",
    "source_ref": "amazon_primary",
    "marketplace": "US",
    "category_ref": "US_beauty",
    "observation_date": "2026-09-01",
    "observed_at": null,
    "time_precision": "date",
    "snapshot_ref": "synthetic-day-1",
    "rank": 7,
    "asin": "TEST000007",
    "title": "SYNTHETIC TEST PRODUCT 7",
    "brand": "SYNTHETIC",
    "source_url": "https://data.example.invalid/test"
  },
  {
    "schema_version": "1.0",
    "source_ref": "amazon_primary",
    "marketplace": "US",
    "category_ref": "US_beauty",
    "observation_date": "2026-09-01",
    "observed_at": null,
    "time_precision": "date",
    "snapshot_ref": "synthetic-day-1",
    "rank": 8,
    "asin": "TEST000008",
    "title": "SYNTHETIC TEST PRODUCT 8",
    "brand": "SYNTHETIC",
    "source_url": "https://data.example.invalid/test"
  },
  {
    "schema_version": "1.0",
    "source_ref": "amazon_primary",
    "marketplace": "US",
    "category_ref": "US_beauty",
    "observation_date": "2026-09-01",
    "observed_at": null,
    "time_precision": "date",
    "snapshot_ref": "synthetic-day-1",
    "rank": 9,
    "asin": "TEST000009",
    "title": "SYNTHETIC TEST PRODUCT 9",
    "brand": "SYNTHETIC",
    "source_url": "https://data.example.invalid/test"
  },
  {
    "schema_version": "1.0",
    "source_ref": "amazon_primary",
    "marketplace": "US",
    "category_ref": "US_beauty",
    "observation_date": "2026-09-01",
    "observed_at": null,
    "time_precision": "date",
    "snapshot_ref": "synthetic-day-1",
    "rank": 10,
    "asin": "TEST000010",
    "title": "SYNTHETIC TEST PRODUCT 10",
    "brand": "SYNTHETIC",
    "source_url": "https://data.example.invalid/test"
  },
  {
    "schema_version": "1.0",
    "source_ref": "amazon_primary",
    "marketplace": "US",
    "category_ref": "US_beauty",
    "observation_date": "2026-09-01",
    "observed_at": null,
    "time_precision": "date",
    "snapshot_ref": "synthetic-day-1",
    "rank": 11,
    "asin": "TEST000011",
    "title": "SYNTHETIC TEST PRODUCT 11",
    "brand": "SYNTHETIC",
    "source_url": "https://data.example.invalid/test"
  },
  {
    "schema_version": "1.0",
    "source_ref": "amazon_primary",
    "marketplace": "US",
    "category_ref": "US_beauty",
    "observation_date": "2026-09-01",
    "observed_at": null,
    "time_precision": "date",
    "snapshot_ref": "synthetic-day-1",
    "rank": 12,
    "asin": "TEST000012",
    "title": "SYNTHETIC TEST PRODUCT 12",
    "brand": "SYNTHETIC",
    "source_url": "https://data.example.invalid/test"
  },
  {
    "schema_version": "1.0",
    "source_ref": "amazon_primary",
    "marketplace": "US",
    "category_ref": "US_beauty",
    "observation_date": "2026-09-01",
    "observed_at": null,
    "time_precision": "date",
    "snapshot_ref": "synthetic-day-1",
    "rank": 13,
    "asin": "TEST000013",
    "title": "SYNTHETIC TEST PRODUCT 13",
    "brand": "SYNTHETIC",
    "source_url": "https://data.example.invalid/test"
  },
  {
    "schema_version": "1.0",
    "source_ref": "amazon_primary",
    "marketplace": "US",
    "category_ref": "US_beauty",
    "observation_date": "2026-09-01",
    "observed_at": null,
    "time_precision": "date",
    "snapshot_ref": "synthetic-day-1",
    "rank": 14,
    "asin": "TEST000014",
    "title": "SYNTHETIC TEST PRODUCT 14",
    "brand": "SYNTHETIC",
    "source_url": "https://data.example.invalid/test"
  },
  {
    "schema_version": "1.0",
    "source_ref": "amazon_primary",
    "marketplace": "US",
    "category_ref": "US_beauty",
    "observation_date": "2026-09-01",
    "observed_at": null,
    "time_precision": "date",
    "snapshot_ref": "synthetic-day-1",
    "rank": 15,
    "asin": "TEST000015",
    "title": "SYNTHETIC TEST PRODUCT 15",
    "brand": "SYNTHETIC",
    "source_url": "https://data.example.invalid/test"
  },
  {
    "schema_version": "1.0",
    "source_ref": "amazon_primary",
    "marketplace": "US",
    "category_ref": "US_beauty",
    "observation_date": "2026-09-01",
    "observed_at": null,
    "time_precision": "date",
    "snapshot_ref": "synthetic-day-1",
    "rank": 16,
    "asin": "TEST000016",
    "title": "SYNTHETIC TEST PRODUCT 16",
    "brand": "SYNTHETIC",
    "source_url": "https://data.example.invalid/test"
  },
  {
    "schema_version": "1.0",
    "source_ref": "amazon_primary",
    "marketplace": "US",
    "category_ref": "US_beauty",
    "observation_date": "2026-09-01",
    "observed_at": null,
    "time_precision": "date",
    "snapshot_ref": "synthetic-day-1",
    "rank": 17,
    "asin": "TEST000017",
    "title": "SYNTHETIC TEST PRODUCT 17",
    "brand": "SYNTHETIC",
    "source_url": "https://data.example.invalid/test"
  },
  {
    "schema_version": "1.0",
    "source_ref": "amazon_primary",
    "marketplace": "US",
    "category_ref": "US_beauty",
    "observation_date": "2026-09-01",
    "observed_at": null,
    "time_precision": "date",
    "snapshot_ref": "synthetic-day-1",
    "rank": 18,
    "asin": "TEST000018",
    "title": "SYNTHETIC TEST PRODUCT 18",
    "brand": "SYNTHETIC",
    "source_url": "https://data.example.invalid/test"
  },
  {
    "schema_version": "1.0",
    "source_ref": "amazon_primary",
    "marketplace": "US",
    "category_ref": "US_beauty",
    "observation_date": "2026-09-01",
    "observed_at": null,
    "time_precision": "date",
    "snapshot_ref": "synthetic-day-1",
    "rank": 19,
    "asin": "TEST000019",
    "title": "SYNTHETIC TEST PRODUCT 19",
    "brand": "SYNTHETIC",
    "source_url": "https://data.example.invalid/test"
  },
  {
    "schema_version": "1.0",
    "source_ref": "amazon_primary",
    "marketplace": "US",
    "category_ref": "US_beauty",
    "observation_date": "2026-09-01",
    "observed_at": null,
    "time_precision": "date",
    "snapshot_ref": "synthetic-day-1",
    "rank": 20,
    "asin": "TEST000020",
    "title": "SYNTHETIC TEST PRODUCT 20",
    "brand": "SYNTHETIC",
    "source_url": "https://data.example.invalid/test"
  },
  {
    "schema_version": "1.0",
    "source_ref": "amazon_primary",
    "marketplace": "US",
    "category_ref": "US_beauty",
    "observation_date": "2026-09-01",
    "observed_at": null,
    "time_precision": "date",
    "snapshot_ref": "synthetic-day-1",
    "rank": 21,
    "asin": "TEST000021",
    "title": "SYNTHETIC TEST PRODUCT 21",
    "brand": "SYNTHETIC",
    "source_url": "https://data.example.invalid/test"
  },
  {
    "schema_version": "1.0",
    "source_ref": "amazon_primary",
    "marketplace": "US",
    "category_ref": "US_beauty",
    "observation_date": "2026-09-01",
    "observed_at": null,
    "time_precision": "date",
    "snapshot_ref": "synthetic-day-1",
    "rank": 22,
    "asin": "TEST000022",
    "title": "SYNTHETIC TEST PRODUCT 22",
    "brand": "SYNTHETIC",
    "source_url": "https://data.example.invalid/test"
  },
  {
    "schema_version": "1.0",
    "source_ref": "amazon_primary",
    "marketplace": "US",
    "category_ref": "US_beauty",
    "observation_date": "2026-09-01",
    "observed_at": null,
    "time_precision": "date",
    "snapshot_ref": "synthetic-day-1",
    "rank": 23,
    "asin": "TEST000023",
    "title": "SYNTHETIC TEST PRODUCT 23",
    "brand": "SYNTHETIC",
    "source_url": "https://data.example.invalid/test"
  },
  {
    "schema_version": "1.0",
    "source_ref": "amazon_primary",
    "marketplace": "US",
    "category_ref": "US_beauty",
    "observation_date": "2026-09-01",